"No.","Time","Source","Destination","Protocol","Length","Info"
"1","0.000000","192.168.66.22","74.125.232.64","TCP","66","50393  >  http(80) [SYN] Seq=0 Win=8192 Len=0 MSS=1460 WS=4 SACK_PERM"
"2","0.498086","74.125.232.64","192.168.66.22","TCP","66","http(80)  >  50393 [SYN, ACK] Seq=0 Ack=1 Win=42900 Len=0 MSS=1367 SACK_PERM WS=128"
"3","0.498420","192.168.66.22","74.125.232.64","TCP","60","50393  >  http(80) [ACK] Seq=1 Ack=1 Win=65616 Len=0"
"4","0.498959","192.168.66.22","74.125.232.64","HTTP","301","GET / HTTP/1.1 "
"5","0.653061","74.125.232.64","192.168.66.22","TCP","66","[TCP Out-Of-Order] http(80)  >  50393 [SYN, ACK] Seq=0 Ack=1 Win=42900 Len=0 MSS=1367 SACK_PERM WS=128"
"6","0.653289","192.168.66.22","74.125.232.64","TCP","66","[TCP Dup ACK 3#1] 50393  >  http(80) [ACK] Seq=248 Ack=1 Win=65616 Len=0 SLE=0 SRE=1"
"7","0.834230","74.125.232.64","192.168.66.22","TCP","54","http(80)  >  50393 [ACK] Seq=1 Ack=248 Win=44032 Len=0"
"8","0.988896","74.125.232.64","192.168.66.22","HTTP","574","HTTP/1.1 302 Found  (text/html)"
"9","0.997513","192.168.66.22","192.168.66.1","DNS","73","Standard query 0xcbaf A www.google.at"
"10","1.196893","192.168.66.22","74.125.232.64","TCP","60","50393  >  http(80) [ACK] Seq=248 Ack=521 Win=65096 Len=0"
"11","1.198590","192.168.66.1","192.168.66.22","DNS","137","Standard query response 0xcbaf A www.google.at A 173.194.116.111 A 173.194.116.119 A 173.194.116.127 A 173.194.116.120"
"12","1.200144","192.168.66.22","www.google.at","TCP","66","50394  >  http(80) [SYN] Seq=0 Win=8192 Len=0 MSS=1460 WS=4 SACK_PERM"
"13","1.200146","192.168.66.22","www.google.at","TCP","66","50395  >  http(80) [SYN] Seq=0 Win=8192 Len=0 MSS=1460 WS=4 SACK_PERM"
"14","1.734793","www.google.at","192.168.66.22","TCP","66","http(80)  >  50394 [SYN, ACK] Seq=0 Ack=1 Win=42900 Len=0 MSS=1367 SACK_PERM WS=128"
"15","1.734831","www.google.at","192.168.66.22","TCP","66","http(80)  >  50395 [SYN, ACK] Seq=0 Ack=1 Win=42900 Len=0 MSS=1367 SACK_PERM WS=128"
"16","1.735131","192.168.66.22","www.google.at","TCP","60","50394  >  http(80) [ACK] Seq=1 Ack=1 Win=65616 Len=0"
"17","1.735133","192.168.66.22","www.google.at","TCP","60","50395  >  http(80) [ACK] Seq=1 Ack=1 Win=65616 Len=0"
"18","1.735776","192.168.66.22","www.google.at","HTTP","338","GET /?gfe_rd=cr&ei=caeAVNyDM86o8wf654FA HTTP/1.1 "
"19","1.884077","www.google.at","192.168.66.22","TCP","66","[TCP Out-Of-Order] http(80)  >  50394 [SYN, ACK] Seq=0 Ack=1 Win=42900 Len=0 MSS=1367 SACK_PERM WS=128"
"20","1.884419","192.168.66.22","www.google.at","TCP","66","[TCP Dup ACK 16#1] 50394  >  http(80) [ACK] Seq=1 Ack=1 Win=65616 Len=0 SLE=0 SRE=1"
"21","2.034518","www.google.at","192.168.66.22","TCP","66","[TCP Out-Of-Order] http(80)  >  50395 [SYN, ACK] Seq=0 Ack=1 Win=42900 Len=0 MSS=1367 SACK_PERM WS=128"
"22","2.034856","192.168.66.22","www.google.at","TCP","66","[TCP Dup ACK 17#1] 50395  >  http(80) [ACK] Seq=285 Ack=1 Win=65616 Len=0 SLE=0 SRE=1"
"23","2.185466","www.google.at","192.168.66.22","TCP","54","http(80)  >  50395 [ACK] Seq=1 Ack=285 Win=44032 Len=0"
"24","2.185523","www.google.at","192.168.66.22","HTTP","1170","HTTP/1.1 302 Found  (text/html)"
"25","2.197516","192.168.66.22","www.google.at","TCP","60","50394  >  http(80) [FIN, ACK] Seq=1 Ack=1 Win=65616 Len=0"
"26","2.197949","192.168.66.22","www.google.at","TCP","66","50396  >  https(443) [SYN] Seq=0 Win=8192 Len=0 MSS=1460 WS=4 SACK_PERM"
"27","2.398118","192.168.66.22","www.google.at","TCP","60","50395  >  http(80) [ACK] Seq=285 Ack=1117 Win=64500 Len=0"
"28","2.555783","www.google.at","192.168.66.22","TCP","54","http(80)  >  50394 [FIN, ACK] Seq=1 Ack=2 Win=43008 Len=0"
"29","2.556120","192.168.66.22","www.google.at","TCP","60","50394  >  http(80) [ACK] Seq=2 Ack=2 Win=65616 Len=0"
"30","2.879157","www.google.at","192.168.66.22","TCP","66","https(443)  >  50396 [SYN, ACK] Seq=0 Ack=1 Win=42900 Len=0 MSS=1367 SACK_PERM WS=128"
"31","2.879491","192.168.66.22","www.google.at","TCP","60","50396  >  https(443) [ACK] Seq=1 Ack=1 Win=65616 Len=0"
"32","2.886210","192.168.66.22","www.google.at","SSLv2","126","Client Hello"
"33","3.032514","www.google.at","192.168.66.22","TCP","66","[TCP Out-Of-Order] https(443)  >  50396 [SYN, ACK] Seq=0 Ack=1 Win=42900 Len=0 MSS=1367 SACK_PERM WS=128"
"34","3.032845","192.168.66.22","www.google.at","TCP","66","[TCP Dup ACK 31#1] 50396  >  https(443) [ACK] Seq=73 Ack=1 Win=65616 Len=0 SLE=0 SRE=1"
"35","3.206233","www.google.at","192.168.66.22","TCP","54","https(443)  >  50396 [ACK] Seq=1 Ack=73 Win=43008 Len=0"
"36","3.209296","www.google.at","192.168.66.22","TLSv1","1421","Server Hello"
"37","3.209363","www.google.at","192.168.66.22","TCP","1421","https(443)  >  50396 [ACK] Seq=1368 Ack=73 Win=43008 Len=1367 [TCP segment of a reassembled PDU]"
"38","3.209426","www.google.at","192.168.66.22","TCP","1416","https(443)  >  50396 [PSH, ACK] Seq=2735 Ack=73 Win=43008 Len=1362 [TCP segment of a reassembled PDU]"
"39","3.210061","192.168.66.22","www.google.at","TCP","60","50396  >  https(443) [ACK] Seq=73 Ack=2735 Win=65616 Len=0"
"40","3.210076","www.google.at","192.168.66.22","TCP","1421","https(443)  >  50396 [ACK] Seq=4097 Ack=73 Win=43008 Len=1367 [TCP segment of a reassembled PDU]"
"41","3.210748","192.168.66.22","www.google.at","TCP","60","50396  >  https(443) [ACK] Seq=73 Ack=5464 Win=65616 Len=0"
"42","3.361416","www.google.at","192.168.66.22","TCP","1421","https(443)  >  50396 [ACK] Seq=5464 Ack=73 Win=43008 Len=1367 [TCP segment of a reassembled PDU]"
"43","3.362205","www.google.at","192.168.66.22","TCP","1421","https(443)  >  50396 [ACK] Seq=6831 Ack=73 Win=43008 Len=1367 [TCP segment of a reassembled PDU]"
"44","3.362275","www.google.at","192.168.66.22","TCP","1421","https(443)  >  50396 [ACK] Seq=8198 Ack=73 Win=43008 Len=1367 [TCP segment of a reassembled PDU]"
"45","3.362319","www.google.at","192.168.66.22","TLSv1","481","Certificate"
"46","3.362373","www.google.at","192.168.66.22","TLSv1","399","Server Key Exchange, Server Hello Done"
"47","3.362881","192.168.66.22","www.google.at","TCP","60","50396  >  https(443) [ACK] Seq=73 Ack=8198 Win=65616 Len=0"
"48","3.362883","192.168.66.22","www.google.at","TCP","60","50396  >  https(443) [ACK] Seq=73 Ack=9992 Win=65616 Len=0"
"49","3.395404","192.168.66.22","www.google.at","TLSv1","188","Client Key Exchange, Change Cipher Spec, Encrypted Handshake Message"
"50","3.738489","www.google.at","192.168.66.22","TLSv1","113","Change Cipher Spec, Encrypted Handshake Message"
"51","3.776069","192.168.66.22","www.google.at","TLSv1","603","Application Data"
"52","4.120850","www.google.at","192.168.66.22","TCP","54","https(443)  >  50396 [ACK] Seq=10396 Ack=756 Win=45184 Len=0"
"53","4.193182","www.google.at","192.168.66.22","TLSv1","1419","Application Data"
"54","4.193250","www.google.at","192.168.66.22","TLSv1","1421","Application Data"
"55","4.193310","www.google.at","192.168.66.22","TLSv1","1417","Application Data"
"56","4.193914","192.168.66.22","www.google.at","TCP","60","50396  >  https(443) [ACK] Seq=756 Ack=13128 Win=65616 Len=0"
"57","4.193968","www.google.at","192.168.66.22","TLSv1","1421","Application Data"
"58","4.194043","www.google.at","192.168.66.22","TLSv1","1421","Application Data"
"59","4.194101","www.google.at","192.168.66.22","TLSv1","1415","Application Data"
"60","4.194160","www.google.at","192.168.66.22","TLSv1","1421","Application Data"
"61","4.194636","192.168.66.22","www.google.at","TCP","60","50396  >  https(443) [ACK] Seq=756 Ack=15858 Win=65616 Len=0"
"62","4.194638","192.168.66.22","www.google.at","TCP","60","50396  >  https(443) [ACK] Seq=756 Ack=18586 Win=65616 Len=0"
"63","4.345395","www.google.at","192.168.66.22","TLSv1","1421","Application Data"
"64","4.346096","192.168.66.22","www.google.at","TCP","60","50396  >  https(443) [ACK] Seq=756 Ack=21320 Win=65616 Len=0"
"65","4.346151","www.google.at","192.168.66.22","TLSv1","1421","Application Data"
"66","4.346229","www.google.at","192.168.66.22","TLSv1","1413","Application Data"
"67","4.346877","www.google.at","192.168.66.22","TLSv1","1421","Application Data"
"68","4.346937","www.google.at","192.168.66.22","TLSv1","1421","Application Data"
"69","4.346941","192.168.66.22","www.google.at","TCP","60","50396  >  https(443) [ACK] Seq=756 Ack=24046 Win=65616 Len=0"
"70","4.347675","192.168.66.22","www.google.at","TCP","60","50396  >  https(443) [ACK] Seq=756 Ack=26780 Win=65616 Len=0"
"71","4.369829","www.google.at","192.168.66.22","TLSv1","1421","Application Data"
"72","4.369896","www.google.at","192.168.66.22","TLSv1","1421","Application Data"
"73","4.369958","www.google.at","192.168.66.22","TLSv1","1421","Application Data"
"74","4.370544","192.168.66.22","www.google.at","TCP","60","50396  >  https(443) [ACK] Seq=756 Ack=29514 Win=65616 Len=0"
"75","4.372287","192.168.66.22","www.google.at","TCP","60","50395  >  http(80) [FIN, ACK] Seq=285 Ack=1117 Win=64500 Len=0"
"76","4.372289","192.168.66.22","www.google.at","TCP","66","50397  >  https(443) [SYN] Seq=0 Win=8192 Len=0 MSS=1460 WS=4 SACK_PERM"
"77","4.391293","192.168.66.22","192.168.66.1","DNS","75","Standard query 0x87dd A ssl.gstatic.com"
"78","4.504100","www.google.at","192.168.66.22","TLSv1","1421","Application Data"
"79","4.504809","192.168.66.22","www.google.at","TCP","60","50396  >  https(443) [ACK] Seq=756 Ack=32248 Win=65616 Len=0"
"80","4.507862","192.168.66.22","www.google.at","TCP","66","50398  >  https(443) [SYN] Seq=0 Win=8192 Len=0 MSS=1460 WS=4 SACK_PERM"
"81","4.511390","192.168.66.22","www.google.at","TCP","66","50399  >  https(443) [SYN] Seq=0 Win=8192 Len=0 MSS=1460 WS=4 SACK_PERM"
"82","4.531014","www.google.at","192.168.66.22","TLSv1","1421","Application Data"
"83","4.531081","www.google.at","192.168.66.22","TLSv1","1421","Application Data"
"84","4.531778","www.google.at","192.168.66.22","TLSv1","1421","Application Data"
"85","4.531779","192.168.66.22","www.google.at","TCP","60","50396  >  https(443) [ACK] Seq=756 Ack=34982 Win=65616 Len=0"
"86","4.580461","www.google.at","192.168.66.22","TLSv1","1421","Application Data"
"87","4.581142","192.168.66.22","www.google.at","TCP","60","50396  >  https(443) [ACK] Seq=756 Ack=37716 Win=65616 Len=0"
"88","4.581245","www.google.at","192.168.66.22","TLSv1","1421","Application Data"
"89","4.581316","www.google.at","192.168.66.22","TLSv1","1421","Application Data"
"90","4.581996","192.168.66.22","www.google.at","TCP","60","50396  >  https(443) [ACK] Seq=756 Ack=40450 Win=65616 Len=0"
"91","4.582012","www.google.at","192.168.66.22","TLSv1","1421","Application Data"
"92","4.615535","www.google.at","192.168.66.22","TLSv1","1421","Application Data, Application Data"
"93","4.616234","192.168.66.22","www.google.at","TCP","60","50396  >  https(443) [ACK] Seq=756 Ack=43184 Win=65616 Len=0"
"94","4.617097","www.google.at","192.168.66.22","TLSv1","1421","Application Data"
"95","4.617877","www.google.at","192.168.66.22","TLSv1","1421","Application Data"
"96","4.618541","192.168.66.22","www.google.at","TCP","60","50396  >  https(443) [ACK] Seq=756 Ack=45918 Win=65616 Len=0"
"97","4.656373","www.google.at","192.168.66.22","TLSv1","1421","Application Data"
"98","4.656427","www.google.at","192.168.66.22","TLSv1","222","Application Data"
"99","4.657054","192.168.66.22","www.google.at","TCP","60","50396  >  https(443) [ACK] Seq=756 Ack=47453 Win=65616 Len=0"
"100","4.689284","192.168.66.22","www.google.at","TLSv1","811","Application Data"
"101","4.809131","www.google.at","192.168.66.22","TCP","54","http(80)  >  50395 [FIN, ACK] Seq=1117 Ack=286 Win=44032 Len=0"
"102","4.809168","www.google.at","192.168.66.22","TCP","66","https(443)  >  50397 [SYN, ACK] Seq=0 Ack=1 Win=42900 Len=0 MSS=1367 SACK_PERM WS=128"
"103","4.809261","192.168.66.1","192.168.66.22","DNS","107","Standard query response 0x87dd A ssl.gstatic.com A 173.194.67.94 A 173.194.67.120"
"104","4.809338","www.google.at","192.168.66.22","TCP","66","https(443)  >  50399 [SYN, ACK] Seq=0 Ack=1 Win=42900 Len=0 MSS=1367 SACK_PERM WS=128"
"105","4.809369","www.google.at","192.168.66.22","TCP","66","https(443)  >  50398 [SYN, ACK] Seq=0 Ack=1 Win=42900 Len=0 MSS=1367 SACK_PERM WS=128"
"106","4.809462","192.168.66.22","www.google.at","TCP","60","50395  >  http(80) [ACK] Seq=286 Ack=1118 Win=64500 Len=0"
"107","4.809464","192.168.66.22","www.google.at","TCP","60","50397  >  https(443) [ACK] Seq=1 Ack=1 Win=65616 Len=0"
"108","4.809465","192.168.66.22","www.google.at","TCP","60","50399  >  https(443) [ACK] Seq=1 Ack=1 Win=65616 Len=0"
"109","4.809846","192.168.66.22","www.google.at","TCP","60","50398  >  https(443) [ACK] Seq=1 Ack=1 Win=65616 Len=0"
"110","4.810966","192.168.66.22","ssl.gstatic.com","TCP","66","50400  >  https(443) [SYN] Seq=0 Win=8192 Len=0 MSS=1460 WS=4 SACK_PERM"
"111","4.810968","192.168.66.22","ssl.gstatic.com","TCP","66","50401  >  https(443) [SYN] Seq=0 Win=8192 Len=0 MSS=1460 WS=4 SACK_PERM"
"112","4.811335","192.168.66.22","www.google.at","TLSv1","203","Client Hello (SNI=www.google.at)"
"113","4.811337","192.168.66.22","www.google.at","TLSv1","203","Client Hello (SNI=www.google.at)"
"114","4.811683","192.168.66.22","www.google.at","TLSv1","203","Client Hello (SNI=www.google.at)"
"115","4.894458","192.168.66.22","192.168.66.1","DNS","75","Standard query 0xf638 A www.gstatic.com"
"116","4.900650","www.google.at","192.168.66.22","TCP","54","https(443)  >  50396 [ACK] Seq=47453 Ack=1513 Win=46592 Len=0"
"117","4.900708","www.google.at","192.168.66.22","TLSv1","1419","Application Data"
"118","4.900771","www.google.at","192.168.66.22","TLSv1","1421","Application Data"
"119","4.901437","www.google.at","192.168.66.22","TLSv1","1417","Application Data"
"120","4.901457","192.168.66.22","www.google.at","TCP","60","50396  >  https(443) [ACK] Seq=1513 Ack=50185 Win=65616 Len=0"
"121","4.901511","www.google.at","192.168.66.22","TLSv1","1421","Application Data"
"122","4.901567","www.google.at","192.168.66.22","TLSv1","1417","Application Data"
"123","4.901633","www.google.at","192.168.66.22","TLSv1","1421","Application Data"
"124","4.901688","www.google.at","192.168.66.22","TLSv1","1421","Application Data"
"125","4.902122","192.168.66.22","www.google.at","TCP","60","50396  >  https(443) [ACK] Seq=1513 Ack=52915 Win=65616 Len=0"
"126","4.902124","192.168.66.22","www.google.at","TCP","60","50396  >  https(443) [ACK] Seq=1513 Ack=55645 Win=65616 Len=0"
"127","4.902192","www.google.at","192.168.66.22","TLSv1","1415","Application Data"
"128","4.902254","www.google.at","192.168.66.22","TLSv1","1421","Application Data"
"129","4.902312","www.google.at","192.168.66.22","TLSv1","1421","Application Data"
"130","4.902520","192.168.66.22","www.google.at","TCP","60","50396  >  https(443) [ACK] Seq=1513 Ack=58373 Win=65616 Len=0"
"131","4.903018","192.168.66.22","www.google.at","TCP","60","50396  >  https(443) [ACK] Seq=1513 Ack=61107 Win=65616 Len=0"
"132","4.920602","www.google.at","192.168.66.22","TLSv1","1415","Application Data"
"133","4.921383","www.google.at","192.168.66.22","TLSv1","1421","Application Data"
"134","4.922051","192.168.66.22","www.google.at","TCP","60","50396  >  https(443) [ACK] Seq=1513 Ack=63835 Win=65616 Len=0"
"135","4.922154","www.google.at","192.168.66.22","TLSv1","1421","Application Data"
"136","5.055056","www.google.at","192.168.66.22","TLSv1","1415","Application Data"
"137","5.055749","192.168.66.22","www.google.at","TCP","60","50396  >  https(443) [ACK] Seq=1513 Ack=66563 Win=65616 Len=0"
"138","5.056584","www.google.at","192.168.66.22","TLSv1","1421","Application Data"
"139","5.060587","www.google.at","192.168.66.22","TLSv1","1421","Application Data"
"140","5.061282","192.168.66.22","www.google.at","TCP","60","50396  >  https(443) [ACK] Seq=1513 Ack=69297 Win=65616 Len=0"
"141","5.061371","www.google.at","192.168.66.22","TLSv1","1421","Application Data"
"142","5.061440","www.google.at","192.168.66.22","TLSv1","1413","Application Data"
"143","5.062127","192.168.66.22","www.google.at","TCP","60","50396  >  https(443) [ACK] Seq=1513 Ack=72023 Win=65616 Len=0"
"144","5.062142","www.google.at","192.168.66.22","TLSv1","1421","Application Data"
"145","5.062216","www.google.at","192.168.66.22","TLSv1","1421","Application Data"
"146","5.062275","www.google.at","192.168.66.22","TLSv1","1421","Application Data"
"147","5.062333","www.google.at","192.168.66.22","TLSv1","1421","Application Data"
"148","5.062391","www.google.at","192.168.66.22","TLSv1","1421","Application Data"
"149","5.062824","192.168.66.22","www.google.at","TCP","60","50396  >  https(443) [ACK] Seq=1513 Ack=74757 Win=65616 Len=0"
"150","5.062892","www.google.at","192.168.66.22","TLSv1","1421","Application Data"
"151","5.062933","www.google.at","192.168.66.22","TCP","66","[TCP Out-Of-Order] https(443)  >  50397 [SYN, ACK] Seq=0 Ack=1 Win=42900 Len=0 MSS=1367 SACK_PERM WS=128"
"152","5.063164","192.168.66.22","www.google.at","TCP","60","50396  >  https(443) [ACK] Seq=1513 Ack=77491 Win=65616 Len=0"
"153","5.063568","192.168.66.22","www.google.at","TCP","60","50396  >  https(443) [ACK] Seq=1513 Ack=80225 Win=65616 Len=0"
"154","5.063569","192.168.66.22","www.google.at","TCP","66","[TCP Dup ACK 107#1] 50397  >  https(443) [ACK] Seq=150 Ack=1 Win=65616 Len=0 SLE=0 SRE=1"
"155","5.081461","www.google.at","192.168.66.22","TCP","54","https(443)  >  50399 [ACK] Seq=1 Ack=150 Win=44032 Len=0"
"156","5.081497","www.google.at","192.168.66.22","TCP","54","https(443)  >  50397 [ACK] Seq=1 Ack=150 Win=44032 Len=0"
"157","5.081528","www.google.at","192.168.66.22","TCP","54","https(443)  >  50398 [ACK] Seq=1 Ack=150 Win=44032 Len=0"
"158","5.081587","www.google.at","192.168.66.22","TLSv1","1421","Server Hello"
"159","5.081647","www.google.at","192.168.66.22","TCP","1421","https(443)  >  50399 [ACK] Seq=1368 Ack=150 Win=44032 Len=1367 [TCP segment of a reassembled PDU]"
"160","5.081701","www.google.at","192.168.66.22","TLSv1","844","Certificate, Server Key Exchange, Server Hello Done"
"161","5.082225","www.google.at","192.168.66.22","TLSv1","1421","Server Hello"
"162","5.082261","192.168.66.22","www.google.at","TCP","60","50399  >  https(443) [ACK] Seq=150 Ack=2735 Win=65616 Len=0"
"163","5.082289","www.google.at","192.168.66.22","TCP","1421","https(443)  >  50397 [ACK] Seq=1368 Ack=150 Win=44032 Len=1367 [TCP segment of a reassembled PDU]"
"164","5.083001","www.google.at","192.168.66.22","TLSv1","844","Certificate, Server Key Exchange, Server Hello Done"
"165","5.083024","192.168.66.22","www.google.at","TCP","60","50397  >  https(443) [ACK] Seq=150 Ack=2735 Win=65616 Len=0"
"166","5.083078","www.google.at","192.168.66.22","TLSv1","1421","Server Hello"
"167","5.115457","192.168.66.22","www.google.at","TLSv1","188","Client Key Exchange, Change Cipher Spec, Encrypted Handshake Message"
"168","5.123746","192.168.66.22","www.google.at","TLSv1","188","Client Key Exchange, Change Cipher Spec, Encrypted Handshake Message"
"169","5.205261","www.google.at","192.168.66.22","TCP","1421","https(443)  >  50398 [ACK] Seq=1368 Ack=150 Win=44032 Len=1367 [TCP segment of a reassembled PDU]"
"170","5.205338","www.google.at","192.168.66.22","TLSv1","844","Certificate, Server Key Exchange, Server Hello Done"
"171","5.205964","192.168.66.22","www.google.at","TCP","60","50398  >  https(443) [ACK] Seq=150 Ack=2735 Win=65616 Len=0"
"172","5.206020","www.google.at","192.168.66.22","TLSv1","1421","Application Data"
"173","5.214631","www.google.at","192.168.66.22","TLSv1","1421","Application Data"
"174","5.214738","192.168.66.1","192.168.66.22","DNS","107","Standard query response 0xf638 A www.gstatic.com A 173.194.78.94 A 173.194.78.120"
"175","5.215307","192.168.66.22","www.google.at","TCP","60","50396  >  https(443) [ACK] Seq=1513 Ack=82959 Win=65616 Len=0"
"176","5.215474","ssl.gstatic.com","192.168.66.22","TCP","66","https(443)  >  50400 [SYN, ACK] Seq=0 Ack=1 Win=42900 Len=0 MSS=1367 SACK_PERM WS=128"
"177","5.215509","ssl.gstatic.com","192.168.66.22","TCP","66","https(443)  >  50401 [SYN, ACK] Seq=0 Ack=1 Win=42900 Len=0 MSS=1367 SACK_PERM WS=128"
"178","5.215803","192.168.66.22","ssl.gstatic.com","TCP","60","50400  >  https(443) [ACK] Seq=1 Ack=1 Win=65616 Len=0"
"179","5.215804","192.168.66.22","ssl.gstatic.com","TCP","60","50401  >  https(443) [ACK] Seq=1 Ack=1 Win=65616 Len=0"
"180","5.216420","192.168.66.22","www.gstatic.com","TCP","66","50402  >  https(443) [SYN] Seq=0 Win=8192 Len=0 MSS=1460 WS=4 SACK_PERM"
"181","5.216422","192.168.66.22","www.gstatic.com","TCP","66","50403  >  https(443) [SYN] Seq=0 Win=8192 Len=0 MSS=1460 WS=4 SACK_PERM"
"182","5.217755","192.168.66.22","ssl.gstatic.com","SSLv2","126","Client Hello"
"183","5.217757","192.168.66.22","ssl.gstatic.com","SSLv2","126","Client Hello"
"184","5.220054","www.google.at","192.168.66.22","TLSv1","1421","Application Data"
"185","5.220839","www.google.at","192.168.66.22","TLSv1","1421","Application Data"
"186","5.220907","www.google.at","192.168.66.22","TLSv1","1421","Application Data"
"187","5.221175","192.168.66.22","www.google.at","TCP","60","50396  >  https(443) [ACK] Seq=1513 Ack=85693 Win=65616 Len=0"
"188","5.221584","www.google.at","192.168.66.22","TLSv1","1421","Application Data"
"189","5.221646","www.google.at","192.168.66.22","TLSv1","1421","Application Data"
"190","5.221916","192.168.66.22","www.google.at","TCP","60","50396  >  https(443) [ACK] Seq=1513 Ack=88427 Win=65616 Len=0"
"191","5.222366","www.google.at","192.168.66.22","TLSv1","1421","Application Data"
"192","5.222425","www.google.at","192.168.66.22","TLSv1","1421","Application Data"
"193","5.222485","www.google.at","192.168.66.22","TLSv1","1421","Application Data"
"194","5.222696","192.168.66.22","www.google.at","TCP","60","50396  >  https(443) [ACK] Seq=1513 Ack=91161 Win=65616 Len=0"
"195","5.223028","192.168.66.22","www.google.at","TCP","60","50396  >  https(443) [ACK] Seq=1513 Ack=93895 Win=65616 Len=0"
"196","5.228960","www.google.at","192.168.66.22","TLSv1","1421","Application Data"
"197","5.229025","www.google.at","192.168.66.22","TLSv1","1421","Application Data"
"198","5.229711","192.168.66.22","www.google.at","TCP","60","50396  >  https(443) [ACK] Seq=1513 Ack=96629 Win=65616 Len=0"
"199","5.238711","192.168.66.22","www.google.at","TLSv1","188","Client Key Exchange, Change Cipher Spec, Encrypted Handshake Message"
"200","5.244864","www.google.at","192.168.66.22","TLSv1","1421","Application Data"
"201","5.245647","www.google.at","192.168.66.22","TLSv1","1421","Application Data"
"202","5.245715","www.google.at","192.168.66.22","TLSv1","1421","Application Data"
"203","5.245773","www.google.at","192.168.66.22","TLSv1","1421","Application Data"
"204","5.246323","192.168.66.22","www.google.at","TCP","60","50396  >  https(443) [ACK] Seq=1513 Ack=99363 Win=65616 Len=0"
"205","5.246325","192.168.66.22","www.google.at","TCP","60","50396  >  https(443) [ACK] Seq=1513 Ack=102097 Win=65616 Len=0"
"206","5.264303","www.google.at","192.168.66.22","TLSv1","1421","Application Data"
"207","5.265084","www.google.at","192.168.66.22","TLSv1","1421","Application Data"
"208","5.265156","www.google.at","192.168.66.22","TLSv1","1421","Application Data"
"209","5.265757","192.168.66.22","www.google.at","TCP","60","50396  >  https(443) [ACK] Seq=1513 Ack=104831 Win=65616 Len=0"
"210","5.265863","www.google.at","192.168.66.22","TLSv1","1421","Application Data"
"211","5.266190","192.168.66.22","www.google.at","TCP","60","50396  >  https(443) [ACK] Seq=1513 Ack=107565 Win=65616 Len=0"
"212","5.281096","www.google.at","192.168.66.22","TLSv1","1421","Application Data"
"213","5.281878","www.google.at","192.168.66.22","TLSv1","1421","Application Data"
"214","5.282541","192.168.66.22","www.google.at","TCP","60","50396  >  https(443) [ACK] Seq=1513 Ack=110299 Win=65616 Len=0"
"215","5.355386","www.google.at","192.168.66.22","TLSv1","1421","Application Data"
"216","5.356165","www.google.at","192.168.66.22","TLSv1","1421","Application Data"
"217","5.356830","192.168.66.22","www.google.at","TCP","60","50396  >  https(443) [ACK] Seq=1513 Ack=113033 Win=65616 Len=0"
"218","5.365159","www.google.at","192.168.66.22","TLSv1","1421","Application Data"
"219","5.377902","www.google.at","192.168.66.22","TLSv1","1421","Application Data"
"220","5.378596","192.168.66.22","www.google.at","TCP","60","50396  >  https(443) [ACK] Seq=1513 Ack=115767 Win=65616 Len=0"
"221","5.401606","www.google.at","192.168.66.22","TLSv1","113","Change Cipher Spec, Encrypted Handshake Message"
"222","5.401643","www.google.at","192.168.66.22","TLSv1","113","Change Cipher Spec, Encrypted Handshake Message"
"223","5.401702","www.google.at","192.168.66.22","TLSv1","1421","Application Data"
"224","5.402393","www.google.at","192.168.66.22","TLSv1","1421","Application Data"
"225","5.403058","192.168.66.22","www.google.at","TCP","60","50396  >  https(443) [ACK] Seq=1513 Ack=118501 Win=65616 Len=0"
"226","5.403161","www.google.at","192.168.66.22","TLSv1","1421","Application Data"
"227","5.409719","192.168.66.22","www.google.at","TLSv1","699","Application Data"
"228","5.410281","192.168.66.22","www.google.at","TLSv1","699","Application Data"
"229","5.413811","www.google.at","192.168.66.22","TLSv1","1421","Application Data"
"230","5.413865","ssl.gstatic.com","192.168.66.22","TCP","66","[TCP Out-Of-Order] https(443)  >  50400 [SYN, ACK] Seq=0 Ack=1 Win=42900 Len=0 MSS=1367 SACK_PERM WS=128"
"231","5.413902","www.gstatic.com","192.168.66.22","TCP","66","https(443)  >  50403 [SYN, ACK] Seq=0 Ack=1 Win=42900 Len=0 MSS=1367 SACK_PERM WS=128"
"232","5.413934","ssl.gstatic.com","192.168.66.22","TCP","54","https(443)  >  50400 [ACK] Seq=1 Ack=73 Win=43008 Len=0"
"233","5.413966","www.gstatic.com","192.168.66.22","TCP","66","https(443)  >  50402 [SYN, ACK] Seq=0 Ack=1 Win=42900 Len=0 MSS=1367 SACK_PERM WS=128"
"234","5.413998","ssl.gstatic.com","192.168.66.22","TCP","54","https(443)  >  50401 [ACK] Seq=1 Ack=73 Win=43008 Len=0"
"235","5.414501","192.168.66.22","www.google.at","TCP","60","50396  >  https(443) [ACK] Seq=1513 Ack=121235 Win=65616 Len=0"
"236","5.414503","192.168.66.22","ssl.gstatic.com","TCP","66","[TCP Dup ACK 178#1] 50400  >  https(443) [ACK] Seq=73 Ack=1 Win=65616 Len=0 SLE=0 SRE=1"
"237","5.414504","192.168.66.22","www.gstatic.com","TCP","60","50403  >  https(443) [ACK] Seq=1 Ack=1 Win=65616 Len=0"
"238","5.414506","192.168.66.22","www.gstatic.com","TCP","60","50402  >  https(443) [ACK] Seq=1 Ack=1 Win=65616 Len=0"
"239","5.414578","ssl.gstatic.com","192.168.66.22","TLSv1","1421","Server Hello"
"240","5.415357","ssl.gstatic.com","192.168.66.22","TCP","1421","https(443)  >  50400 [ACK] Seq=1368 Ack=73 Win=43008 Len=1367 [TCP segment of a reassembled PDU]"
"241","5.415426","ssl.gstatic.com","192.168.66.22","TCP","1416","https(443)  >  50400 [PSH, ACK] Seq=2735 Ack=73 Win=43008 Len=1362 [TCP segment of a reassembled PDU]"
"242","5.415482","ssl.gstatic.com","192.168.66.22","TCP","1421","https(443)  >  50400 [ACK] Seq=4097 Ack=73 Win=43008 Len=1367 [TCP segment of a reassembled PDU]"
"243","5.415690","192.168.66.22","www.gstatic.com","SSLv2","126","Client Hello"
"244","5.415691","192.168.66.22","www.gstatic.com","SSLv2","126","Client Hello"
"245","5.415693","192.168.66.22","ssl.gstatic.com","TCP","60","50400  >  https(443) [ACK] Seq=73 Ack=2735 Win=65616 Len=0"
"246","5.416034","192.168.66.22","ssl.gstatic.com","TCP","60","50400  >  https(443) [ACK] Seq=73 Ack=5464 Win=65616 Len=0"
"247","5.416115","ssl.gstatic.com","192.168.66.22","TCP","1421","https(443)  >  50400 [ACK] Seq=5464 Ack=73 Win=43008 Len=1367 [TCP segment of a reassembled PDU]"
"248","5.416174","ssl.gstatic.com","192.168.66.22","TCP","1421","https(443)  >  50400 [ACK] Seq=6831 Ack=73 Win=43008 Len=1367 [TCP segment of a reassembled PDU]"
"249","5.416233","ssl.gstatic.com","192.168.66.22","TCP","1421","https(443)  >  50400 [ACK] Seq=8198 Ack=73 Win=43008 Len=1367 [TCP segment of a reassembled PDU]"
"250","5.416288","ssl.gstatic.com","192.168.66.22","TLSv1","481","Certificate"
"251","5.416795","192.168.66.22","ssl.gstatic.com","TCP","60","50400  >  https(443) [ACK] Seq=73 Ack=8198 Win=65616 Len=0"
"252","5.416796","192.168.66.22","ssl.gstatic.com","TCP","60","50400  >  https(443) [ACK] Seq=73 Ack=9992 Win=65616 Len=0"
"253","5.416942","ssl.gstatic.com","192.168.66.22","TLSv1","1421","Server Hello"
"254","5.417008","ssl.gstatic.com","192.168.66.22","TCP","1421","https(443)  >  50401 [ACK] Seq=1368 Ack=73 Win=43008 Len=1367 [TCP segment of a reassembled PDU]"
"255","5.417068","ssl.gstatic.com","192.168.66.22","TCP","1416","https(443)  >  50401 [PSH, ACK] Seq=2735 Ack=73 Win=43008 Len=1362 [TCP segment of a reassembled PDU]"
"256","5.417129","ssl.gstatic.com","192.168.66.22","TCP","1421","https(443)  >  50401 [ACK] Seq=4097 Ack=73 Win=43008 Len=1367 [TCP segment of a reassembled PDU]"
"257","5.417189","ssl.gstatic.com","192.168.66.22","TCP","1421","https(443)  >  50401 [ACK] Seq=5464 Ack=73 Win=43008 Len=1367 [TCP segment of a reassembled PDU]"
"258","5.417609","192.168.66.22","ssl.gstatic.com","TCP","60","50401  >  https(443) [ACK] Seq=73 Ack=2735 Win=65616 Len=0"
"259","5.417697","ssl.gstatic.com","192.168.66.22","TCP","1421","https(443)  >  50401 [ACK] Seq=6831 Ack=73 Win=43008 Len=1367 [TCP segment of a reassembled PDU]"
"260","5.417757","ssl.gstatic.com","192.168.66.22","TCP","1421","https(443)  >  50401 [ACK] Seq=8198 Ack=73 Win=43008 Len=1367 [TCP segment of a reassembled PDU]"
"261","5.417802","ssl.gstatic.com","192.168.66.22","TLSv1","481","Certificate"
"262","5.417860","www.google.at","192.168.66.22","TLSv1","1421","Application Data"
"263","5.417917","www.google.at","192.168.66.22","TLSv1","1421","Application Data"
"264","5.417955","192.168.66.22","ssl.gstatic.com","TCP","60","50401  >  https(443) [ACK] Seq=73 Ack=5464 Win=65616 Len=0"
"265","5.418290","192.168.66.22","ssl.gstatic.com","TCP","60","50401  >  https(443) [ACK] Seq=73 Ack=8198 Win=65616 Len=0"
"266","5.418291","192.168.66.22","ssl.gstatic.com","TCP","60","50401  >  https(443) [ACK] Seq=73 Ack=9992 Win=65188 Len=0"
"267","5.418461","www.google.at","192.168.66.22","TLSv1","1421","Application Data"
"268","5.418713","192.168.66.22","www.google.at","TCP","60","50396  >  https(443) [ACK] Seq=1513 Ack=123969 Win=65616 Len=0"
"269","5.435599","www.google.at","192.168.66.22","TLSv1","1421","Application Data"
"270","5.436273","192.168.66.22","www.google.at","TCP","60","50396  >  https(443) [ACK] Seq=1513 Ack=126703 Win=65616 Len=0"
"271","5.438132","ssl.gstatic.com","192.168.66.22","TLSv1","399","Server Key Exchange, Server Hello Done"
"272","5.438186","ssl.gstatic.com","192.168.66.22","TLSv1","399","Server Key Exchange, Server Hello Done"
"273","5.438218","www.google.at","192.168.66.22","TLSv1","113","Change Cipher Spec, Encrypted Handshake Message"
"274","5.438873","www.google.at","192.168.66.22","TLSv1","1421","Application Data"
"275","5.441124","192.168.66.22","www.google.at","TLSv1","683","Application Data"
"276","5.451455","192.168.66.22","ssl.gstatic.com","TLSv1","188","Client Key Exchange, Change Cipher Spec, Encrypted Handshake Message"
"277","5.452865","192.168.66.22","ssl.gstatic.com","TLSv1","188","Client Key Exchange, Change Cipher Spec, Encrypted Handshake Message"
"278","5.504672","www.google.at","192.168.66.22","TLSv1","1421","Application Data"
"279","5.505350","192.168.66.22","www.google.at","TCP","60","50396  >  https(443) [ACK] Seq=1513 Ack=129437 Win=65616 Len=0"
"280","5.505454","www.google.at","192.168.66.22","TLSv1","1421","Application Data"
"281","5.505523","www.google.at","192.168.66.22","TLSv1","1421","Application Data"
"282","5.506202","192.168.66.22","www.google.at","TCP","60","50396  >  https(443) [ACK] Seq=1513 Ack=132171 Win=65616 Len=0"
"283","5.515373","www.google.at","192.168.66.22","TLSv1","1421","Application Data"
"284","5.516156","www.google.at","192.168.66.22","TLSv1","1421","Application Data"
"285","5.516228","www.google.at","192.168.66.22","TLSv1","1421","Application Data"
"286","5.516507","192.168.66.22","www.google.at","TCP","60","50396  >  https(443) [ACK] Seq=1513 Ack=134905 Win=76552 Len=0"
"287","5.544082","www.google.at","192.168.66.22","TLSv1","1421","Application Data"
"288","5.544779","192.168.66.22","www.google.at","TCP","60","50396  >  https(443) [ACK] Seq=1513 Ack=137639 Win=76552 Len=0"
"289","5.544871","www.google.at","192.168.66.22","TLSv1","1421","Application Data"
"290","5.555040","www.google.at","192.168.66.22","TLSv1","1421","Application Data"
"291","5.555733","192.168.66.22","www.google.at","TCP","60","50396  >  https(443) [ACK] Seq=1513 Ack=140373 Win=76552 Len=0"
"292","5.555825","www.google.at","192.168.66.22","TLSv1","1421","Application Data"
"293","5.555891","www.google.at","192.168.66.22","TLSv1","1421","Application Data"
"294","5.556602","www.google.at","192.168.66.22","TLSv1","1421","Application Data"
"295","5.556610","192.168.66.22","www.google.at","TCP","60","50396  >  https(443) [ACK] Seq=1513 Ack=143107 Win=76552 Len=0"
"296","5.556669","www.google.at","192.168.66.22","TLSv1","1421","Application Data"
"297","5.556727","www.google.at","192.168.66.22","TLSv1","1421","Application Data"
"298","5.557329","192.168.66.22","www.google.at","TCP","60","50396  >  https(443) [ACK] Seq=1513 Ack=145841 Win=76552 Len=0"
"299","5.575505","www.google.at","192.168.66.22","TLSv1","1421","Application Data, Application Data"
"300","5.576184","192.168.66.22","www.google.at","TCP","60","50396  >  https(443) [ACK] Seq=1513 Ack=148575 Win=76552 Len=0"
"301","5.576279","www.google.at","192.168.66.22","TLSv1","1421","Application Data"
"302","5.576349","www.google.at","192.168.66.22","TLSv1","1421","Application Data"
"303","5.576413","www.google.at","192.168.66.22","TLSv1","1421","Application Data"
"304","5.577002","192.168.66.22","www.google.at","TCP","60","50396  >  https(443) [ACK] Seq=1513 Ack=151309 Win=76552 Len=0"
"305","5.593884","www.google.at","192.168.66.22","TLSv1","1421","Application Data"
"306","5.593948","www.google.at","192.168.66.22","TLSv1","1419","Application Data"
"307","5.594584","192.168.66.22","www.google.at","TCP","60","50396  >  https(443) [ACK] Seq=1513 Ack=154043 Win=90220 Len=0"
"308","5.598552","www.google.at","192.168.66.22","TLSv1","939","Application Data"
"309","5.598885","192.168.66.22","www.google.at","TCP","60","50397  >  https(443) [ACK] Seq=929 Ack=5834 Win=65616 Len=0"
"310","5.599303","www.google.at","192.168.66.22","TLSv1","1421","Application Data"
"311","5.599363","www.google.at","192.168.66.22","TLSv1","1421","Application Data"
"312","5.600064","192.168.66.22","www.google.at","TCP","60","50396  >  https(443) [ACK] Seq=1513 Ack=156777 Win=90220 Len=0"
"313","5.605174","www.google.at","192.168.66.22","TLSv1","1421","Application Data"
"314","5.605943","www.google.at","192.168.66.22","TLSv1","1419","Application Data"
"315","5.606010","www.google.at","192.168.66.22","TLSv1","1419","Application Data"
"316","5.606066","www.google.at","192.168.66.22","TLSv1","1419","Application Data"
"317","5.606670","192.168.66.22","www.google.at","TCP","60","50399  >  https(443) [ACK] Seq=929 Ack=6314 Win=65616 Len=0"
"318","5.606728","www.google.at","192.168.66.22","TLSv1","1421","Application Data"
"319","5.606795","www.google.at","192.168.66.22","TLSv1","1417","Application Data"
"320","5.606853","www.google.at","192.168.66.22","TLSv1","1419","Application Data"
"321","5.606911","www.google.at","192.168.66.22","TLSv1","1419","Application Data"
"322","5.607058","192.168.66.22","www.google.at","TCP","60","50399  >  https(443) [ACK] Seq=929 Ack=9046 Win=65616 Len=0"
"323","5.607398","192.168.66.22","www.google.at","TCP","60","50399  >  https(443) [ACK] Seq=929 Ack=11774 Win=65616 Len=0"
"324","5.611864","www.google.at","192.168.66.22","TLSv1","1419","Application Data"
"325","5.611921","www.gstatic.com","192.168.66.22","TCP","54","https(443)  >  50403 [ACK] Seq=1 Ack=73 Win=43008 Len=0"
"326","5.612569","192.168.66.22","www.google.at","TCP","60","50399  >  https(443) [ACK] Seq=929 Ack=14504 Win=65616 Len=0"
"327","5.612657","www.gstatic.com","192.168.66.22","TLSv1","1421","Server Hello"
"328","5.612725","www.gstatic.com","192.168.66.22","TCP","1421","https(443)  >  50403 [ACK] Seq=1368 Ack=73 Win=43008 Len=1367 [TCP segment of a reassembled PDU]"
"329","5.613429","www.gstatic.com","192.168.66.22","TCP","1416","https(443)  >  50403 [PSH, ACK] Seq=2735 Ack=73 Win=43008 Len=1362 [TCP segment of a reassembled PDU]"
"330","5.613448","192.168.66.22","www.gstatic.com","TCP","60","50403  >  https(443) [ACK] Seq=73 Ack=2735 Win=65616 Len=0"
"331","5.613503","www.gstatic.com","192.168.66.22","TCP","1421","https(443)  >  50403 [ACK] Seq=4097 Ack=73 Win=43008 Len=1367 [TCP segment of a reassembled PDU]"
"332","5.613563","www.gstatic.com","192.168.66.22","TCP","1421","https(443)  >  50403 [ACK] Seq=5464 Ack=73 Win=43008 Len=1367 [TCP segment of a reassembled PDU]"
"333","5.614191","192.168.66.22","www.gstatic.com","TCP","60","50403  >  https(443) [ACK] Seq=73 Ack=5464 Win=65616 Len=0"
"334","5.655907","www.gstatic.com","192.168.66.22","TCP","1421","https(443)  >  50403 [ACK] Seq=6831 Ack=73 Win=43008 Len=1367 [TCP segment of a reassembled PDU]"
"335","5.656603","192.168.66.22","www.gstatic.com","TCP","60","50403  >  https(443) [ACK] Seq=73 Ack=8198 Win=65616 Len=0"
"336","5.656697","www.gstatic.com","192.168.66.22","TCP","1421","https(443)  >  50403 [ACK] Seq=8198 Ack=73 Win=43008 Len=1367 [TCP segment of a reassembled PDU]"
"337","5.656753","www.gstatic.com","192.168.66.22","TLSv1","481","Certificate"
"338","5.656784","www.gstatic.com","192.168.66.22","TCP","54","https(443)  >  50402 [ACK] Seq=1 Ack=73 Win=43008 Len=0"
"339","5.656841","www.gstatic.com","192.168.66.22","TLSv1","1421","Server Hello"
"340","5.656903","www.gstatic.com","192.168.66.22","TCP","1421","https(443)  >  50402 [ACK] Seq=1368 Ack=73 Win=43008 Len=1367 [TCP segment of a reassembled PDU]"
"341","5.657363","192.168.66.22","www.gstatic.com","TCP","60","50403  >  https(443) [ACK] Seq=73 Ack=9992 Win=65616 Len=0"
"342","5.657364","192.168.66.22","www.gstatic.com","TCP","60","50402  >  https(443) [ACK] Seq=73 Ack=2735 Win=65616 Len=0"
"343","5.657451","www.gstatic.com","192.168.66.22","TCP","1416","https(443)  >  50402 [PSH, ACK] Seq=2735 Ack=73 Win=43008 Len=1362 [TCP segment of a reassembled PDU]"
"344","5.657515","www.gstatic.com","192.168.66.22","TCP","1421","https(443)  >  50402 [ACK] Seq=4097 Ack=73 Win=43008 Len=1367 [TCP segment of a reassembled PDU]"
"345","5.658205","192.168.66.22","www.gstatic.com","TCP","60","50402  >  https(443) [ACK] Seq=73 Ack=5464 Win=65616 Len=0"
"346","5.676667","www.gstatic.com","192.168.66.22","TCP","1421","https(443)  >  50402 [ACK] Seq=5464 Ack=73 Win=43008 Len=1367 [TCP segment of a reassembled PDU]"
"347","5.677451","www.gstatic.com","192.168.66.22","TCP","1421","https(443)  >  50402 [ACK] Seq=6831 Ack=73 Win=43008 Len=1367 [TCP segment of a reassembled PDU]"
"348","5.677519","www.gstatic.com","192.168.66.22","TCP","1421","https(443)  >  50402 [ACK] Seq=8198 Ack=73 Win=43008 Len=1367 [TCP segment of a reassembled PDU]"
"349","5.677572","www.gstatic.com","192.168.66.22","TLSv1","481","Certificate"
"350","5.677613","www.gstatic.com","192.168.66.22","TLSv1","399","Server Key Exchange, Server Hello Done"
"351","5.677661","www.gstatic.com","192.168.66.22","TLSv1","399","Server Key Exchange, Server Hello Done"
"352","5.678121","192.168.66.22","www.gstatic.com","TCP","60","50402  >  https(443) [ACK] Seq=73 Ack=8198 Win=65616 Len=0"
"353","5.678122","192.168.66.22","www.gstatic.com","TCP","60","50402  >  https(443) [ACK] Seq=73 Ack=9992 Win=65616 Len=0"
"354","5.700655","www.google.at","192.168.66.22","TLSv1","1421","Application Data"
